{
  "id": "infobar",
  "dos": [
    { "text": "Await appendNotification()'s returned promise before touching the notification further, it resolves only after the Lit-based moz-message-bar has flushed its update (and, for l10n labels, after document.l10n.translateFragment), so the shadow DOM and alert role aren't guaranteed to exist before that." }
  ],
  "donts": [
    { "text": "Don't insert a notification-message element outside the stack a NotificationBox created, its close()/control getter walks up via this.closest(\".notificationbox-stack\")._notificationBox, a back-reference only set inside NotificationBox's own stack getter, so a manually-placed notification throws when closed." },
    { "text": "Don't give a button a popup id and expect a graceful no-op if it's wrong, setButtons calls document.getElementById(popup).openPopup(...) directly with no null check, so a missing popup id throws at click time." }
  ],
  "behavior": [
    { "text": "Inherits message-bar's own two-stage dismiss: the close button fires the cancelable \"message-bar:user-dismissed\" first, and only if nothing prevents it does the bar remove itself; \"message-bar:close\" fires separately from disconnectedCallback on any removal, dismissed or not." }
  ],
  "reference": [
    {
      "text": "Microsoft's InfoBar control, the same kind of inline notification, ties its severity to specific real criteria: Error for a problem that's occurred, Warning for something that might cause one later, Success for a completed long-running task, Default for general information. It also explicitly recommends against this kind of control for time-sensitive alerts or for confirming a user action, a dialog is the recommended control for those instead.",
      "source": "https://learn.microsoft.com/en-us/windows/apps/develop/ui/controls/infobar"
    }
  ]
}
